serving/docker/tuned_configs/qwen3-coder-30b/NVIDIA_H100_80GB_HBM3_FUSED_MOE_LORA_W2_EXPAND.json
{
  "8": {
    "1": {
      "1": {
        "32": {
          "384": {
            "2048": {
              "BLOCK_SIZE_M": 16,
              "BLOCK_SIZE_N": 256,
              "BLOCK_SIZE_K": 16,
              "GROUP_SIZE_M": 4,
              "num_warps": 4,
              "num_stages": 2
            }
          }
        }
      },
      "2": {
        "32": {
          "384": {
            "2048": {
              "BLOCK_SIZE_M": 16,
              "BLOCK_SIZE_N": 256,
              "BLOCK_SIZE_K": 16,
              "GROUP_SIZE_M": 32,
              "num_warps": 4,
              "num_stages": 2
            }
          }
        }
      },
      "4": {
        "32": {
          "384": {
            "2048": {
              "BLOCK_SIZE_M": 16,
              "BLOCK_SIZE_N": 256,
              "BLOCK_SIZE_K": 16,
              "GROUP_SIZE_M": 1,
              "num_warps": 4,
              "num_stages": 2
            }
          }
        }
      },
      "8": {
        "32": {
          "384": {
            "2048": {
              "BLOCK_SIZE_M": 16,
              "BLOCK_SIZE_N": 128,
              "BLOCK_SIZE_K": 16,
              "GROUP_SIZE_M": 1,
              "num_warps": 4,
              "num_stages": 2
            }
          }
        }
      },
      "16": {
        "32": {
          "384": {
            "2048": {
              "BLOCK_SIZE_M": 16,
              "BLOCK_SIZE_N": 128,
              "BLOCK_SIZE_K": 16,
              "GROUP_SIZE_M": 1,
              "num_warps": 4,
              "num_stages": 2
            }
          }
        }
      },
      "32": {
        "32": {
          "384": {
            "2048": {
              "BLOCK_SIZE_M": 16,
              "BLOCK_SIZE_N": 128,
              "BLOCK_SIZE_K": 16,
              "GROUP_SIZE_M": 4,
              "num_warps": 4,
              "num_stages": 2
            }
          }
        }
      },
      "64": {
        "32": {
          "384": {
            "2048": {
              "BLOCK_SIZE_M": 16,
              "BLOCK_SIZE_N": 128,
              "BLOCK_SIZE_K": 16,
              "GROUP_SIZE_M": 64,
              "num_warps": 4,
              "num_stages": 2
            }
          }
        }
      },
      "128": {
        "32": {
          "384": {
            "2048": {
              "BLOCK_SIZE_M": 16,
              "BLOCK_SIZE_N": 128,
              "BLOCK_SIZE_K": 16,
              "GROUP_SIZE_M": 1,
              "num_warps": 4,
              "num_stages": 2
            }
          }
        }
      },
      "256": {
        "32": {
          "384": {
            "2048": {
              "BLOCK_SIZE_M": 16,
              "BLOCK_SIZE_N": 128,
              "BLOCK_SIZE_K": 16,
              "GROUP_SIZE_M": 64,
              "num_warps": 4,
              "num_stages": 2
            }
          }
        }
      },
      "512": {
        "32": {
          "384": {
            "2048": {
              "BLOCK_SIZE_M": 16,
              "BLOCK_SIZE_N": 128,
              "BLOCK_SIZE_K": 16,
              "GROUP_SIZE_M": 32,
              "num_warps": 4,
              "num_stages": 2
            }
          }
        }
      },
      "1024": {
        "32": {
          "384": {
            "2048": {
              "BLOCK_SIZE_M": 16,
              "BLOCK_SIZE_N": 128,
              "BLOCK_SIZE_K": 16,
              "GROUP_SIZE_M": 32,
              "num_warps": 4,
              "num_stages": 2
            }
          }
        }
      },
      "1536": {
        "32": {
          "384": {
            "2048": {
              "BLOCK_SIZE_M": 16,
              "BLOCK_SIZE_N": 128,
              "BLOCK_SIZE_K": 16,
              "GROUP_SIZE_M": 1,
              "num_warps": 4,
              "num_stages": 2
            }
          }
        }
      },
      "2048": {
        "32": {
          "384": {
            "2048": {
              "BLOCK_SIZE_M": 32,
              "BLOCK_SIZE_N": 128,
              "BLOCK_SIZE_K": 16,
              "GROUP_SIZE_M": 64,
              "num_warps": 4,
              "num_stages": 3
            }
          }
        }
      },
      "4096": {
        "32": {
          "384": {
            "2048": {
              "BLOCK_SIZE_M": 64,
              "BLOCK_SIZE_N": 256,
              "BLOCK_SIZE_K": 16,
              "GROUP_SIZE_M": 64,
              "num_warps": 4,
              "num_stages": 2
            }
          }
        }
      },
      "5120": {
        "32": {
          "384": {
            "2048": {
              "BLOCK_SIZE_M": 64,
              "BLOCK_SIZE_N": 256,
              "BLOCK_SIZE_K": 16,
              "GROUP_SIZE_M": 8,
              "num_warps": 4,
              "num_stages": 2
            }
          }
        }
      },
      "6144": {
        "32": {
          "384": {
            "2048": {
              "BLOCK_SIZE_M": 64,
              "BLOCK_SIZE_N": 256,
              "BLOCK_SIZE_K": 16,
              "GROUP_SIZE_M": 16,
              "num_warps": 4,
              "num_stages": 2
            }
          }
        }
      },
      "7168": {
        "32": {
          "384": {
            "2048": {
              "BLOCK_SIZE_M": 64,
              "BLOCK_SIZE_N": 256,
              "BLOCK_SIZE_K": 16,
              "GROUP_SIZE_M": 8,
              "num_warps": 4,
              "num_stages": 2
            }
          }
        }
      },
      "8192": {
        "32": {
          "384": {
            "2048": {
              "BLOCK_SIZE_M": 128,
              "BLOCK_SIZE_N": 64,
              "BLOCK_SIZE_K": 16,
              "GROUP_SIZE_M": 64,
              "num_warps": 4,
              "num_stages": 2
            }
          }
        }
      },
      "10240": {
        "32": {
          "384": {
            "2048": {
              "BLOCK_SIZE_M": 128,
              "BLOCK_SIZE_N": 64,
              "BLOCK_SIZE_K": 16,
              "GROUP_SIZE_M": 16,
              "num_warps": 4,
              "num_stages": 2
            }
          }
        }
      }
    }
  }
}
