serving/docker/tuned_configs/qwen3-coder-30b/NVIDIA_H100_80GB_HBM3_EXPAND_TRUE.json
{
    "16": {
        "1": {
            "1": {
                "32": {
                    "128": {
                        "block_m": 16,
                        "block_n": 32,
                        "block_k": 32,
                        "num_warps": 4,
                        "num_ctas": 1,
                        "num_stages": 5,
                        "group_size_m": 8
                    },
                    "2048": {
                        "block_m": 16,
                        "block_n": 64,
                        "block_k": 32,
                        "num_warps": 4,
                        "num_ctas": 1,
                        "num_stages": 3,
                        "group_size_m": 32
                    }
                }
            },
            "2": {
                "32": {
                    "128": {
                        "block_m": 16,
                        "block_n": 128,
                        "block_k": 32,
                        "num_warps": 4,
                        "num_ctas": 1,
                        "num_stages": 2,
                        "group_size_m": 32
                    },
                    "2048": {
                        "block_m": 16,
                        "block_n": 64,
                        "block_k": 32,
                        "num_warps": 8,
                        "num_ctas": 1,
                        "num_stages": 2,
                        "group_size_m": 1
                    }
                }
            },
            "4": {
                "32": {
                    "128": {
                        "block_m": 16,
                        "block_n": 32,
                        "block_k": 32,
                        "num_warps": 4,
                        "num_ctas": 1,
                        "num_stages": 3,
                        "group_size_m": 64
                    },
                    "2048": {
                        "block_m": 16,
                        "block_n": 128,
                        "block_k": 32,
                        "num_warps": 8,
                        "num_ctas": 1,
                        "num_stages": 3,
                        "group_size_m": 32
                    }
                }
            },
            "8": {
                "32": {
                    "128": {
                        "block_m": 16,
                        "block_n": 64,
                        "block_k": 32,
                        "num_warps": 4,
                        "num_ctas": 1,
                        "num_stages": 2,
                        "group_size_m": 8
                    },
                    "2048": {
                        "block_m": 16,
                        "block_n": 128,
                        "block_k": 16,
                        "num_warps": 4,
                        "num_ctas": 1,
                        "num_stages": 3,
                        "group_size_m": 8
                    }
                }
            },
            "16": {
                "32": {
                    "128": {
                        "block_m": 16,
                        "block_n": 64,
                        "block_k": 32,
                        "num_warps": 4,
                        "num_ctas": 1,
                        "num_stages": 2,
                        "group_size_m": 64
                    },
                    "2048": {
                        "block_m": 16,
                        "block_n": 128,
                        "block_k": 32,
                        "num_warps": 8,
                        "num_ctas": 1,
                        "num_stages": 2,
                        "group_size_m": 8
                    }
                }
            },
            "32": {
                "32": {
                    "128": {
                        "block_m": 16,
                        "block_n": 64,
                        "block_k": 32,
                        "num_warps": 4,
                        "num_ctas": 1,
                        "num_stages": 3,
                        "group_size_m": 1
                    },
                    "2048": {
                        "block_m": 16,
                        "block_n": 256,
                        "block_k": 32,
                        "num_warps": 8,
                        "num_ctas": 1,
                        "num_stages": 2,
                        "group_size_m": 64
                    }
                }
            },
            "64": {
                "32": {
                    "128": {
                        "block_m": 16,
                        "block_n": 128,
                        "block_k": 32,
                        "num_warps": 4,
                        "num_ctas": 1,
                        "num_stages": 2,
                        "group_size_m": 1
                    },
                    "2048": {
                        "block_m": 16,
                        "block_n": 128,
                        "block_k": 32,
                        "num_warps": 4,
                        "num_ctas": 1,
                        "num_stages": 3,
                        "group_size_m": 1
                    }
                }
            },
            "128": {
                "32": {
                    "128": {
                        "block_m": 16,
                        "block_n": 128,
                        "block_k": 32,
                        "num_warps": 4,
                        "num_ctas": 1,
                        "num_stages": 2,
                        "group_size_m": 32
                    },
                    "2048": {
                        "block_m": 16,
                        "block_n": 128,
                        "block_k": 32,
                        "num_warps": 4,
                        "num_ctas": 1,
                        "num_stages": 2,
                        "group_size_m": 1
                    }
                }
            },
            "256": {
                "32": {
                    "128": {
                        "block_m": 32,
                        "block_n": 64,
                        "block_k": 32,
                        "num_warps": 4,
                        "num_ctas": 1,
                        "num_stages": 2,
                        "group_size_m": 32
                    },
                    "2048": {
                        "block_m": 16,
                        "block_n": 256,
                        "block_k": 16,
                        "num_warps": 4,
                        "num_ctas": 1,
                        "num_stages": 3,
                        "group_size_m": 1
                    }
                }
            },
            "512": {
                "32": {
                    "128": {
                        "block_m": 64,
                        "block_n": 64,
                        "block_k": 32,
                        "num_warps": 4,
                        "num_ctas": 1,
                        "num_stages": 2,
                        "group_size_m": 32
                    },
                    "2048": {
                        "block_m": 32,
                        "block_n": 128,
                        "block_k": 16,
                        "num_warps": 4,
                        "num_ctas": 1,
                        "num_stages": 3,
                        "group_size_m": 1
                    }
                }
            },
            "1024": {
                "32": {
                    "128": {
                        "block_m": 32,
                        "block_n": 64,
                        "block_k": 32,
                        "num_warps": 4,
                        "num_ctas": 1,
                        "num_stages": 2,
                        "group_size_m": 1
                    },
                    "2048": {
                        "block_m": 64,
                        "block_n": 128,
                        "block_k": 32,
                        "num_warps": 4,
                        "num_ctas": 1,
                        "num_stages": 2,
                        "group_size_m": 1
                    }
                }
            },
            "1536": {
                "32": {
                    "128": {
                        "block_m": 64,
                        "block_n": 64,
                        "block_k": 32,
                        "num_warps": 4,
                        "num_ctas": 1,
                        "num_stages": 2,
                        "group_size_m": 1
                    },
                    "2048": {
                        "block_m": 64,
                        "block_n": 128,
                        "block_k": 32,
                        "num_warps": 4,
                        "num_ctas": 1,
                        "num_stages": 2,
                        "group_size_m": 1
                    }
                }
            },
            "2048": {
                "32": {
                    "128": {
                        "block_m": 64,
                        "block_n": 64,
                        "block_k": 32,
                        "num_warps": 4,
                        "num_ctas": 1,
                        "num_stages": 2,
                        "group_size_m": 1
                    },
                    "2048": {
                        "block_m": 64,
                        "block_n": 128,
                        "block_k": 32,
                        "num_warps": 4,
                        "num_ctas": 1,
                        "num_stages": 2,
                        "group_size_m": 1
                    }
                }
            },
            "4096": {
                "32": {
                    "128": {
                        "block_m": 64,
                        "block_n": 64,
                        "block_k": 32,
                        "num_warps": 4,
                        "num_ctas": 1,
                        "num_stages": 2,
                        "group_size_m": 1
                    },
                    "2048": {
                        "block_m": 128,
                        "block_n": 64,
                        "block_k": 16,
                        "num_warps": 4,
                        "num_ctas": 1,
                        "num_stages": 2,
                        "group_size_m": 1
                    }
                }
            },
            "5120": {
                "32": {
                    "128": {
                        "block_m": 64,
                        "block_n": 64,
                        "block_k": 32,
                        "num_warps": 4,
                        "num_ctas": 1,
                        "num_stages": 2,
                        "group_size_m": 1
                    },
                    "2048": {
                        "block_m": 64,
                        "block_n": 128,
                        "block_k": 32,
                        "num_warps": 4,
                        "num_ctas": 1,
                        "num_stages": 2,
                        "group_size_m": 64
                    }
                }
            },
            "6144": {
                "32": {
                    "128": {
                        "block_m": 64,
                        "block_n": 64,
                        "block_k": 32,
                        "num_warps": 4,
                        "num_ctas": 1,
                        "num_stages": 2,
                        "group_size_m": 1
                    },
                    "2048": {
                        "block_m": 64,
                        "block_n": 128,
                        "block_k": 32,
                        "num_warps": 4,
                        "num_ctas": 1,
                        "num_stages": 2,
                        "group_size_m": 1
                    }
                }
            },
            "7168": {
                "32": {
                    "128": {
                        "block_m": 64,
                        "block_n": 64,
                        "block_k": 32,
                        "num_warps": 4,
                        "num_ctas": 1,
                        "num_stages": 2,
                        "group_size_m": 4
                    },
                    "2048": {
                        "block_m": 64,
                        "block_n": 128,
                        "block_k": 32,
                        "num_warps": 4,
                        "num_ctas": 1,
                        "num_stages": 2,
                        "group_size_m": 1
                    }
                }
            },
            "8192": {
                "32": {
                    "128": {
                        "block_m": 64,
                        "block_n": 128,
                        "block_k": 32,
                        "num_warps": 4,
                        "num_ctas": 1,
                        "num_stages": 2,
                        "group_size_m": 8
                    },
                    "2048": {
                        "block_m": 64,
                        "block_n": 256,
                        "block_k": 32,
                        "num_warps": 4,
                        "num_ctas": 1,
                        "num_stages": 2,
                        "group_size_m": 1
                    }
                }
            },
            "10240": {
                "32": {
                    "128": {
                        "block_m": 64,
                        "block_n": 128,
                        "block_k": 32,
                        "num_warps": 4,
                        "num_ctas": 1,
                        "num_stages": 2,
                        "group_size_m": 64
                    },
                    "2048": {
                        "block_m": 64,
                        "block_n": 128,
                        "block_k": 32,
                        "num_warps": 4,
                        "num_ctas": 1,
                        "num_stages": 2,
                        "group_size_m": 64
                    }
                }
            }
        },
        "3": {
            "1": {
                "32": {
                    "4096": {
                        "block_m": 32,
                        "block_n": 64,
                        "block_k": 16,
                        "num_warps": 8,
                        "num_ctas": 1,
                        "num_stages": 4,
                        "group_size_m": 32
                    },
                    "2048": {
                        "block_m": 16,
                        "block_n": 32,
                        "block_k": 16,
                        "num_warps": 8,
                        "num_ctas": 1,
                        "num_stages": 5,
                        "group_size_m": 32
                    }
                }
            },
            "2": {
                "32": {
                    "4096": {
                        "block_m": 16,
                        "block_n": 64,
                        "block_k": 16,
                        "num_warps": 8,
                        "num_ctas": 1,
                        "num_stages": 3,
                        "group_size_m": 4
                    },
                    "2048": {
                        "block_m": 16,
                        "block_n": 32,
                        "block_k": 16,
                        "num_warps": 8,
                        "num_ctas": 1,
                        "num_stages": 3,
                        "group_size_m": 1
                    }
                }
            },
            "4": {
                "32": {
                    "4096": {
                        "block_m": 16,
                        "block_n": 64,
                        "block_k": 16,
                        "num_warps": 4,
                        "num_ctas": 1,
                        "num_stages": 4,
                        "group_size_m": 16
                    },
                    "2048": {
                        "block_m": 16,
                        "block_n": 32,
                        "block_k": 16,
                        "num_warps": 4,
                        "num_ctas": 1,
                        "num_stages": 2,
                        "group_size_m": 4
                    }
                }
            },
            "8": {
                "32": {
                    "4096": {
                        "block_m": 16,
                        "block_n": 64,
                        "block_k": 16,
                        "num_warps": 4,
                        "num_ctas": 1,
                        "num_stages": 3,
                        "group_size_m": 1
                    },
                    "2048": {
                        "block_m": 16,
                        "block_n": 32,
                        "block_k": 16,
                        "num_warps": 4,
                        "num_ctas": 1,
                        "num_stages": 2,
                        "group_size_m": 1
                    }
                }
            },
            "16": {
                "32": {
                    "4096": {
                        "block_m": 16,
                        "block_n": 256,
                        "block_k": 16,
                        "num_warps": 4,
                        "num_ctas": 1,
                        "num_stages": 3,
                        "group_size_m": 16
                    },
                    "2048": {
                        "block_m": 16,
                        "block_n": 256,
                        "block_k": 16,
                        "num_warps": 8,
                        "num_ctas": 1,
                        "num_stages": 2,
                        "group_size_m": 4
                    }
                }
            },
            "32": {
                "32": {
                    "4096": {
                        "block_m": 16,
                        "block_n": 256,
                        "block_k": 16,
                        "num_warps": 4,
                        "num_ctas": 1,
                        "num_stages": 4,
                        "group_size_m": 1
                    },
                    "2048": {
                        "block_m": 32,
                        "block_n": 128,
                        "block_k": 16,
                        "num_warps": 4,
                        "num_ctas": 1,
                        "num_stages": 2,
                        "group_size_m": 8
                    }
                }
            },
            "64": {
                "32": {
                    "4096": {
                        "block_m": 16,
                        "block_n": 256,
                        "block_k": 16,
                        "num_warps": 4,
                        "num_ctas": 1,
                        "num_stages": 5,
                        "group_size_m": 1
                    },
                    "2048": {
                        "block_m": 32,
                        "block_n": 128,
                        "block_k": 16,
                        "num_warps": 4,
                        "num_ctas": 1,
                        "num_stages": 2,
                        "group_size_m": 1
                    }
                }
            },
            "128": {
                "32": {
                    "4096": {
                        "block_m": 16,
                        "block_n": 256,
                        "block_k": 16,
                        "num_warps": 4,
                        "num_ctas": 1,
                        "num_stages": 3,
                        "group_size_m": 1
                    },
                    "2048": {
                        "block_m": 32,
                        "block_n": 256,
                        "block_k": 16,
                        "num_warps": 4,
                        "num_ctas": 1,
                        "num_stages": 3,
                        "group_size_m": 1
                    }
                }
            },
            "256": {
                "32": {
                    "4096": {
                        "block_m": 32,
                        "block_n": 256,
                        "block_k": 16,
                        "num_warps": 4,
                        "num_ctas": 1,
                        "num_stages": 5,
                        "group_size_m": 1
                    },
                    "2048": {
                        "block_m": 32,
                        "block_n": 256,
                        "block_k": 16,
                        "num_warps": 4,
                        "num_ctas": 1,
                        "num_stages": 3,
                        "group_size_m": 1
                    }
                }
            },
            "512": {
                "32": {
                    "4096": {
                        "block_m": 32,
                        "block_n": 256,
                        "block_k": 16,
                        "num_warps": 4,
                        "num_ctas": 1,
                        "num_stages": 3,
                        "group_size_m": 1
                    },
                    "2048": {
                        "block_m": 32,
                        "block_n": 256,
                        "block_k": 16,
                        "num_warps": 4,
                        "num_ctas": 1,
                        "num_stages": 3,
                        "group_size_m": 1
                    }
                }
            },
            "1024": {
                "32": {
                    "4096": {
                        "block_m": 64,
                        "block_n": 256,
                        "block_k": 16,
                        "num_warps": 4,
                        "num_ctas": 1,
                        "num_stages": 3,
                        "group_size_m": 1
                    },
                    "2048": {
                        "block_m": 64,
                        "block_n": 256,
                        "block_k": 16,
                        "num_warps": 4,
                        "num_ctas": 1,
                        "num_stages": 3,
                        "group_size_m": 1
                    }
                }
            },
            "1536": {
                "32": {
                    "4096": {
                        "block_m": 64,
                        "block_n": 256,
                        "block_k": 16,
                        "num_warps": 4,
                        "num_ctas": 1,
                        "num_stages": 3,
                        "group_size_m": 1
                    },
                    "2048": {
                        "block_m": 64,
                        "block_n": 256,
                        "block_k": 16,
                        "num_warps": 4,
                        "num_ctas": 1,
                        "num_stages": 2,
                        "group_size_m": 1
                    }
                }
            },
            "2048": {
                "32": {
                    "4096": {
                        "block_m": 64,
                        "block_n": 256,
                        "block_k": 16,
                        "num_warps": 4,
                        "num_ctas": 1,
                        "num_stages": 4,
                        "group_size_m": 1
                    },
                    "2048": {
                        "block_m": 64,
                        "block_n": 256,
                        "block_k": 16,
                        "num_warps": 4,
                        "num_ctas": 1,
                        "num_stages": 3,
                        "group_size_m": 1
                    }
                }
            },
            "4096": {
                "32": {
                    "4096": {
                        "block_m": 128,
                        "block_n": 128,
                        "block_k": 16,
                        "num_warps": 4,
                        "num_ctas": 1,
                        "num_stages": 4,
                        "group_size_m": 64
                    },
                    "2048": {
                        "block_m": 64,
                        "block_n": 256,
                        "block_k": 16,
                        "num_warps": 4,
                        "num_ctas": 1,
                        "num_stages": 2,
                        "group_size_m": 1
                    }
                }
            },
            "5120": {
                "32": {
                    "4096": {
                        "block_m": 64,
                        "block_n": 256,
                        "block_k": 16,
                        "num_warps": 4,
                        "num_ctas": 1,
                        "num_stages": 3,
                        "group_size_m": 1
                    },
                    "2048": {
                        "block_m": 64,
                        "block_n": 256,
                        "block_k": 16,
                        "num_warps": 4,
                        "num_ctas": 1,
                        "num_stages": 3,
                        "group_size_m": 1
                    }
                }
            },
            "6144": {
                "32": {
                    "4096": {
                        "block_m": 64,
                        "block_n": 256,
                        "block_k": 16,
                        "num_warps": 4,
                        "num_ctas": 1,
                        "num_stages": 3,
                        "group_size_m": 1
                    },
                    "2048": {
                        "block_m": 128,
                        "block_n": 128,
                        "block_k": 16,
                        "num_warps": 4,
                        "num_ctas": 1,
                        "num_stages": 5,
                        "group_size_m": 64
                    }
                }
            },
            "7168": {
                "32": {
                    "4096": {
                        "block_m": 64,
                        "block_n": 256,
                        "block_k": 16,
                        "num_warps": 4,
                        "num_ctas": 1,
                        "num_stages": 2,
                        "group_size_m": 1
                    },
                    "2048": {
                        "block_m": 64,
                        "block_n": 256,
                        "block_k": 16,
                        "num_warps": 4,
                        "num_ctas": 1,
                        "num_stages": 5,
                        "group_size_m": 1
                    }
                }
            },
            "8192": {
                "32": {
                    "4096": {
                        "block_m": 64,
                        "block_n": 256,
                        "block_k": 16,
                        "num_warps": 4,
                        "num_ctas": 1,
                        "num_stages": 2,
                        "group_size_m": 1
                    },
                    "2048": {
                        "block_m": 64,
                        "block_n": 256,
                        "block_k": 16,
                        "num_warps": 4,
                        "num_ctas": 1,
                        "num_stages": 4,
                        "group_size_m": 1
                    }
                }
            },
            "10240": {
                "32": {
                    "4096": {
                        "block_m": 64,
                        "block_n": 256,
                        "block_k": 16,
                        "num_warps": 4,
                        "num_ctas": 1,
                        "num_stages": 4,
                        "group_size_m": 1
                    },
                    "2048": {
                        "block_m": 64,
                        "block_n": 256,
                        "block_k": 16,
                        "num_warps": 4,
                        "num_ctas": 1,
                        "num_stages": 3,
                        "group_size_m": 1
                    }
                }
            }
        }
    }
}